Name,description,timestamp,begin,end,altitudeMode,tessellate,extrude,visibility,drawOrder,icon,atr_gr_id,atr_gr_tipo,atr_gr_visible,atr_gr_tiene_q,atr_gr_alerta,equip_a_codigo,equip_a_observaciones,equip_a_estado_fecha,equip_a_fecha_declaracion,estado_id,equip_b_senalizacion_ext,equip_b_acceso_modo,equip_b_nombre,cerramiento_id,acc_id,acc_dis_id,equip_b_tiene_interes,equip_b_superficie_aprox,cerramiento_material_id,web,zona_rec_es_merendero,tipo_zona_recreativa_id,OGR_GEOM_WKT
,,,,,,-1,-1,-1,,,79229,18,true,false,,HERAR00021,Area de descanso con 2 cubo de basura,2011-06-08T22:00:00Z,2004-08-25T22:00:00Z,3,true,Carretera,N-623,1,1,2,false,0,4,,false,1,POINT (-3.796586636354967 42.68417658986138)
,,,,,,-1,-1,-1,,,79230,18,true,false,,HERAR00022,Area de descanso con 1 cubo de basura,2011-06-08T22:00:00Z,2004-08-25T22:00:00Z,3,true,Carretera,N-623,1,1,2,false,0,4,,false,1,POINT (-3.802105817772489 42.705201705337586)
,,,,,,-1,-1,-1,,,79231,18,true,false,,HERAR00023,Area de descanso con 2 cubo de basura,2011-06-08T22:00:00Z,2004-08-25T22:00:00Z,3,true,Carretera,N-623,2,1,2,false,0,6,,false,1,POINT (-3.803595647200305 42.745904462319928)
,,,,,,-1,-1,-1,,,79232,18,true,false,,HERAR00024,,2011-06-08T22:00:00Z,2004-08-25T22:00:00Z,3,false,Carretera,San Felices del Rudrón,1,1,2,false,0,4,,false,1,POINT (-3.802063095424238 42.752128874668195)
,,,,,,-1,-1,-1,,,79233,18,true,false,,HERAR00025,Junto a rio,2011-06-08T22:00:00Z,2004-08-25T22:00:00Z,3,false,Puente,San Felices del Rudrón,1,1,2,false,0,4,,false,1,POINT (-3.801827550905777 42.752814927803186)
,,,,,,-1,-1,-1,,,79234,18,true,false,,HERAR00026,Vistas panorámicas con 3 cubos de basura,2011-06-08T22:00:00Z,2004-08-25T22:00:00Z,3,true,Carretera,Valdelateja,2,1,2,false,0,6,,false,1,POINT (-3.773167017686317 42.773985356208371)
,,,,,,-1,-1,-1,,,79235,18,true,false,,HERAR00027,Vistas panorámicas con 3 cubos de basura,2011-06-08T22:00:00Z,2004-08-25T22:00:00Z,3,true,Carretera,Quintanilla Escalada,2,1,2,false,0,6,,false,1,POINT (-3.766398185145476 42.789105684312133)
,,,,,,-1,-1,-1,,,79236,18,true,false,,HERAR00028,Junto al Rudrón,2011-06-08T22:00:00Z,2004-08-25T22:00:00Z,3,false,Calle,Covanera,1,1,2,false,0,4,,false,1,POINT (-3.801714120431672 42.735480472325797)
,,,,,,-1,-1,-1,,,79237,18,true,false,,HERAR00029,5 cubos de basura,2011-06-08T22:00:00Z,2004-08-25T22:00:00Z,3,false,Pasarela,Tablada del Rudrón,2,1,2,false,0,12,,false,1,POINT (-3.842638780375137 42.72378591048129)
,,,,,,-1,-1,-1,,,79238,18,true,false,,HERAR00030,Campa junto a la Ermita,2011-06-08T22:00:00Z,2004-08-25T22:00:00Z,3,false,A pie,Ermita Tablada,1,2,2,false,0,4,,false,1,POINT (-3.840623095929858 42.725565771363591)
,,,,,,-1,-1,-1,,,79240,18,true,false,,HERAR00032,Plaza de Dobro,2011-06-08T22:00:00Z,2004-08-25T22:00:00Z,1,false,Calle,Plaza Fuente Cadalso,1,1,3,false,0,4,,false,1,POINT (-3.63287837980879 42.80793200385606)
,,,,,,-1,-1,-1,,,79241,18,true,false,,HERAR00033,Junto al rio,2011-06-08T22:00:00Z,2004-08-25T22:00:00Z,3,false,Calle,Valdelateja,1,1,2,false,0,4,,false,1,POINT (-3.768631965362578 42.774970446101115)
,,,,,,-1,-1,-1,,,79242,18,true,false,,HERAR00034,Se accede en sentido Burgos,2011-06-08T22:00:00Z,2004-08-25T22:00:00Z,1,true,Carretera,Quintanilla Escalada,2,1,1,false,0,6,,false,1,POINT (-3.766200463346335 42.788935907515743)
,,,,,,-1,-1,-1,,,79243,18,true,false,,HERAR00035,1 mesa de pin-pon,2011-06-08T22:00:00Z,2004-08-25T22:00:00Z,1,false,Calle,La Isla,1,1,2,false,0,4,,false,1,POINT (-3.777171395858961 42.810717697335399)
,,,,,,-1,-1,-1,,,80296,18,true,true,,HRDAR00001,,2010-02-14T23:00:00Z,1989-06-26T22:00:00Z,1,false,,Carrascal Pueblo,3,1,2,false,1000,9,,false,2,POINT (-3.896177676039354 41.367043181187299)
,,,,,,-1,-1,-1,,,80297,18,true,true,,HRDAR00002,,2010-02-14T23:00:00Z,2004-05-31T22:00:00Z,1,true,,Carrascal Río,3,1,2,false,2000,9,,false,2,POINT (-3.902377926273004 41.366056063097616)
,,,,,,-1,-1,-1,,,80298,18,true,true,,HRDAR00003,,2010-02-14T23:00:00Z,2004-05-31T22:00:00Z,1,true,,Área recreativa de Sebúlcor,3,1,2,false,1000,9,,false,2,POINT (-3.889915916114369 41.271006087312472)
,,,,,,-1,-1,-1,,,80299,18,true,true,,HRDAR00004,,2010-02-14T23:00:00Z,2004-05-31T22:00:00Z,3,false,,Fuente de la Salud,2,1,2,false,300,21,,false,2,POINT (-3.719206296853225 41.298706954896652)
,,,,,,-1,-1,-1,,,80300,18,false,true,,HRDAR00005,,2010-02-15T23:00:00Z,2004-05-31T22:00:00Z,3,false,,El Plantío,1,2,2,false,300,1,,false,1,POINT (-3.737156104326266 41.299624118865445)
,,,,,,-1,-1,-1,,,80301,18,false,true,,HRDAR00006,,2010-02-16T23:00:00Z,2004-05-31T22:00:00Z,3,false,,Los Lavaderos,1,2,2,false,200,1,,false,1,POINT (-3.732748244204822 41.301027643628352)
,,,,,,-1,-1,-1,,,80587,18,true,false,,HRRAR00001,,2010-05-31T22:00:00Z,2010-02-27T23:00:00Z,1,true,"Partiendo de Montejo de la Vega, cruzamos el puente de acceso a la localidad desde la carretera de Fuentelcesped y continuamos por el camino que encontramos a la izquierda, al lado del margen del río Riaza, durante aproximadamente un kilómetro doscientos metros.",La Pisadera,3,1,1,false,5000,9,,false,2,POINT (-3.664012781498985 41.547766768781244)
,,,,,,-1,-1,-1,,,80588,18,true,false,,HRRAR00002,,2010-05-31T22:00:00Z,2009-05-31T22:00:00Z,1,true,"Partiendo de Maderuelo, en dirección al camino de los huertos, continuamos por el marquen izquierdo del embalse de Linares del Arroyo durante aproximadamente un kilómetro doscientos metros.",La Rivilla,2,1,1,false,4000,9,,false,2,POINT (-3.515768500606146 41.491151838679983)
,,,,,,-1,-1,-1,,,80589,18,true,false,,HRRAR00003,,2010-05-31T22:00:00Z,2009-05-31T22:00:00Z,3,false,La entrada a esta área recreativa está situada en la intersección entre la carretera C-114 y el puente de acceso a Maderuelo sobre el embalse de Linares del Arroyo.,Vera Cruz,2,1,2,false,7000,9,,false,2,POINT (-3.518441875928742 41.484910259393395)
,,,,,,-1,-1,-1,,,81552,18,true,false,false,LGNAR00001,,2010-05-25T22:00:00Z,2008-12-08T23:00:00Z,3,false,Desde Neila dirección Vilavelallo (La Rioja),La Cerrrada,3,1,3,false,0,6,,false,1,POINT (-2.980964951420108 42.080929455779433)
,,,,,,-1,-1,-1,,,81553,18,true,false,,LGNAR00002,,2010-05-25T22:00:00Z,2008-12-08T23:00:00Z,1,false,En casco urbano de Neila junto a la plaza municipal,La Cueva,3,1,3,false,300,6,,false,1,POINT (-2.997212826974197 42.05969404764042)
,,,,,,-1,-1,-1,,,81666,18,true,false,,LNUAR00001,,2010-06-13T22:00:00Z,2010-03-01T23:00:00Z,3,false,"Por la pista forestal asfaltada que parte a mano izquierda a la entrada de Covaleda llegando desde Duruelo de la Sierra, a 10,4 km mano izquierda junto a la pista.",Bocalprado,2,1,2,true,0,4,,false,1,POINT (-2.838616685922138 41.946160515487534)
,,,,,,-1,-1,-1,,,81667,18,true,false,,LNUAR00002,Los contenedores son bidones.,2010-06-13T22:00:00Z,2010-03-01T23:00:00Z,3,false,"Por la carretera SO-850 de Covaleda a Duruelo de la Sierra, a la entrada de Duruelo parte una pista asfaltada señalizada a mano derecha que tras finalizar continua por un camino a mano izquierda que tras 0,8 km conduce al me",Castroviejo,3,1,2,true,10000,11,,false,1,POINT (-2.920965422295243 41.987650152698002)
,,,,,,-1,-1,-1,,,81668,18,true,false,,LNUAR00003,,2010-06-13T22:00:00Z,2010-03-01T23:00:00Z,3,false,"Por la pista forestal asfaltada que parte a mano izquierda a la entrada de Covaleda llegando desde Duruelo de la Sierra, a 4 km a mano derecha junto a la pista.",Fuente de la Guarza,1,1,2,true,0,1,,false,1,POINT (-2.882248193034265 41.955706553337599)
,,,,,,-1,-1,-1,,,81669,18,true,false,,LNUAR00004,Los contenedores son bidones.,2010-06-13T22:00:00Z,2010-03-01T23:00:00Z,3,false,"Por la carretera SO-850 que va de Covaleda a Duruelo de la Sierra, a la entrada de Duruelo parte una pista forestal asfaltada a mano derecha que se¤aliza Castroviejo, y cuando finaliza esta se coge el camino de tierra que pa",Fuente el Berro,2,1,2,true,0,4,,false,1,POINT (-2.921121312658173 41.99827802009542)
,,,,,,-1,-1,-1,,,89102,18,false,false,,SGRAR00024,Represa en el arroyo de la Garganta de los pozos. Zona de mesas y parrillas ocupan 1/2 Ha entre el río y la pista forestal a La Amoclón.,2010-06-14T22:00:00Z,1996-06-19T22:00:00Z,4,false,Carretera de Mombeltrán a Ramacastañas. Entre la garganta de los Pozos y Río Puerto.,Pozos de Felipe,1,1,2,false,2500,1,,false,4,POINT (-5.035142272633857 40.216802656995434)
,,,,,,-1,-1,-1,,,89103,18,true,true,,SGRAR00025,Zona de baño cercana. Bar en verano. Amplios aparcamientos. Señalizacion del Parque.,2010-06-14T22:00:00Z,1996-06-19T22:00:00Z,1,true,"Por la carretera de Navalonguilla hacia Navalguijo, a la altura del puente sobre La Garganta de los Caballeros.",El Berrocal,2,1,3,false,15000,3,,false,2,POINT (-5.515738884094244 40.268290656106771)
,,,,,,-1,-1,-1,,,89104,18,true,false,,SGRAR00026,"Posibilidad de mejorar, muy cerca del rio Tormes. Inicio de senda de cinco lagunas",2010-06-14T22:00:00Z,1996-06-19T22:00:00Z,4,true,"Por la pista forestal asfaltada de Navalperal de Tormes al río Tormes. Cruzado el puente sobre el río Tormes o siguiendo el GR-10, a la altura del puente sobre el río Tormes en Navalperal.",Prado del Toro,1,1,2,false,6000,1,,false,1,POINT (-5.289979437300264 40.347865791014627)
,,,,,,-1,-1,-1,,,76255,18,true,false,false,BSFAR00018,"Esta área recreativa está en la trayectoria de los senderos PRSA-12 (Cepeda-Mogarraz) y PRSA-19 (Cepeda-Monforte)
Una de las barbacoas tiene matachispas",2011-06-08T22:00:00Z,2000-07-10T22:00:00Z,1,true,Este área recreativa está dentro del casco urbano de la población de Cepeda,Los Llanos,3,1,2,true,2170,11,,false,2,POINT (-6.036698030024708 40.469469031433583)
,,,,,,-1,-1,-1,,,89106,18,true,false,,SGRAR00028,"Con zona verde, sombra de olmos y seto de cipreses. Mirador al pueblo y al barranco de las Cinco Villas.",2010-06-14T22:00:00Z,1996-06-19T22:00:00Z,1,false,En la carretera de San Esteban a Santa Cruz. Zona próxima al pueblo.,Ermita de San Andrés,1,1,2,false,4500,4,,false,2,POINT (-4.984807968598901 40.266467937742028)
,,,,,,-1,-1,-1,,,89107,18,false,false,,SGRAR00029,Fuente con tres caños.,2010-06-14T22:00:00Z,1996-06-19T22:00:00Z,4,false,En un ensanche de la carretera AV-913 en la subida al puerto de Serranillos.,Fuente de los Morenos.,1,1,2,false,100,1,,false,1,POINT (-4.953132430832333 40.307062665667019)
,,,,,,-1,-1,-1,,,89108,18,false,false,,SGRAR00030,,2010-06-14T22:00:00Z,1996-06-19T22:00:00Z,4,false,Al pie de la carretera pasado el cruce del puerto de Serranillos con el de Pedro Bernardo.,La Chinita,1,1,2,false,200,1,,false,4,POINT (-4.961912393088692 40.265912705986402)
,,,,,,-1,-1,-1,,,89109,18,true,true,,SGRAR00031,Arbolado. Con bar. Entrada de puertas de madera. Señalizado. Zona natural de baño: Puente medieval de un solo ojo. Q Calidad.,2010-06-14T22:00:00Z,1996-06-19T22:00:00Z,1,true,"Desde Navacepeda de Tormes, cruzado el río Tormes y por la carretera de Barbellido. Desde el camino de la Plataforma, en el Km 7 antes del puente de Las juntas, camino de Barbellido.",Pozo de las Paredes,3,2,3,false,4000,36,,false,2,POINT (-5.249897942064096 40.345677987196865)
,,,,,,-1,-1,-1,,,89110,18,false,false,,SGRAR00032,Pequeña zona de merendero al lado de una regadera del rio Tormes,2010-06-14T22:00:00Z,1996-06-19T22:00:00Z,4,false,"Por la carretera C-500 de La Aliseda de Tormes a Navalperal de Tormes, a 1,7 km en el pk 38,6 parte una pista a la derecha que tras 0,1 km conduce al merendero.",La Aliseda,1,1,2,false,850,1,,false,1,POINT (-5.37922466224607 40.331209415926779)
,,,,,,-1,-1,-1,,,85821,18,true,false,,PEUAR00016,Juegos infantiles,2011-06-12T22:00:00Z,1995-05-29T22:00:00Z,1,false,Entrada pueblo Puebla de Lillo,Ermita Virgen de las Nieves,3,1,3,false,3911,11,,false,2,POINT (-5.267755246962622 43.004096218974738)
,,,,,,-1,-1,-1,,,89111,18,false,false,,SGRAR00033,,2010-06-14T22:00:00Z,1996-06-19T22:00:00Z,4,false,"Por la carretera C-500 de La Aliseda de Tormes a Navalperal de Tormes, a 1,7 km en el pk 38,6 parte una pista a la derecha que tras 0,1 km conduce al merendero.",Las Colmenillas,4,1,2,false,0,4,,false,3,POINT (-5.37922466224607 40.331209415926779)
,,,,,,-1,-1,-1,,,89112,18,true,false,,SGRAR00034,"Explanada con arboles, antiguas eras de trillar, fuente y zona de recreo.",2010-06-14T22:00:00Z,1996-06-19T22:00:00Z,4,false,En casco urbano del Tremedal.,Monumento al pastor,1,1,2,false,2000,1,,false,4,POINT (-5.621661978821763 40.352021999250169)
,,,,,,-1,-1,-1,,,90085,18,true,false,false,LGTAR00001,,,1990-10-10T23:00:00Z,2,false,,La Tiembla,2,1,2,false,,16,,,2,POINT (-6.476783520029626 42.230705655317678)
,,,,,,-1,-1,-1,,,82498,18,true,false,,LSNAR00001,,2010-05-31T22:00:00Z,1970-01-14T23:00:00Z,1,true,,La Viquiella,1,1,1,true,0,1,,false,2,POINT (-6.721058969395608 42.115843356012299)
,,,,,,-1,-1,-1,,,82499,18,true,false,,LSNAR00002,,2010-05-31T22:00:00Z,1970-01-14T23:00:00Z,1,true,,Custa Llago,1,1,2,true,0,1,,false,2,POINT (-6.72328118540825 42.113573041323136)
,,,,,,-1,-1,-1,,,82500,18,true,false,,LSNAR00003,,2010-05-31T22:00:00Z,2006-01-14T23:00:00Z,1,true,,La Riviella,1,1,2,true,0,1,,false,2,POINT (-6.667306344375308 42.107603154134189)
,,,,,,-1,-1,-1,,,82501,18,true,false,,LSNAR00004,,2010-05-31T22:00:00Z,2008-01-14T23:00:00Z,1,true,,El Folgoso,1,1,1,true,0,1,,false,2,POINT (-6.701385420452536 42.128725018545026)
,,,,,,-1,-1,-1,,,82502,18,true,false,,LSNAR00005,,2010-05-31T22:00:00Z,2002-01-14T23:00:00Z,1,true,,Vigo de Sanabria,1,1,2,true,0,1,,false,2,POINT (-6.691573839967623 42.132058134601898)
,,,,,,-1,-1,-1,,,82503,18,true,false,,LSNAR00006,,2010-05-31T22:00:00Z,2005-01-14T23:00:00Z,1,true,,Río Truchas,1,1,2,true,0,1,,false,2,POINT (-6.723497773823638 42.087586989554922)
,,,,,,-1,-1,-1,,,82504,18,true,false,,LSNAR00007,,2010-05-31T22:00:00Z,2006-01-14T23:00:00Z,1,true,,Corneira,1,1,2,true,0,1,,false,2,POINT (-6.643494290880882 42.101703975606554)
,,,,,,-1,-1,-1,,,82505,18,true,false,,LSNAR00008,,2010-05-31T22:00:00Z,2006-01-14T23:00:00Z,1,true,,Porto,1,1,2,true,0,1,,false,2,POINT (-6.899069067123485 42.166009049535035)
,,,,,,-1,-1,-1,,,82506,18,true,false,,LSNAR00009,,2010-05-31T22:00:00Z,2000-01-14T23:00:00Z,1,false,,Área recreativa de Ballagona,4,1,2,true,0,4,,false,2,POINT (-6.672844855939937 42.117899129711681)
,,,,,,-1,-1,-1,,,83553,18,true,false,,LVFAR00001,2 papeleras,2010-03-02T23:00:00Z,2007-12-31T23:00:00Z,1,true,,Area recreativa Cerecinos,1,1,1,false,400,1,,false,2,POINT (-5.481210443736613 41.902447117403057)
,,,,,,-1,-1,-1,,,83554,18,true,false,,LVFAR00002,,2010-03-02T23:00:00Z,2006-12-31T23:00:00Z,1,true,,Tapioles,1,1,1,false,2000,1,,false,2,POINT (-5.499401882002693 41.866897394757999)
,,,,,,-1,-1,-1,,,83555,18,true,false,,LVFAR00003,,2010-03-02T23:00:00Z,2006-12-31T23:00:00Z,1,false,,Bancos camino de A.R. Tapioles,1,1,1,false,500,1,,false,5,POINT (-5.492687765289008 41.861809774847927)
,,,,,,-1,-1,-1,,,83556,18,true,false,,LVFAR00004,,2010-03-02T23:00:00Z,2005-12-31T23:00:00Z,1,true,,Area recreativa Cañizo,1,1,1,false,600,1,,false,2,POINT (-5.499663517438747 41.771304797258829)
,,,,,,-1,-1,-1,,,83557,18,true,false,,LVFAR00005,,2010-03-02T23:00:00Z,2007-12-31T23:00:00Z,1,true,,Revellinos,3,1,1,false,400,5,,false,2,POINT (-5.579816009381005 41.889852647675717)
,,,,,,-1,-1,-1,,,83558,18,true,false,,LVFAR00006,,2010-03-02T23:00:00Z,2005-12-31T23:00:00Z,1,true,,San Agustín,1,1,1,false,30,1,,false,2,POINT (-5.601254513201792 41.881980298238787)
,,,,,,-1,-1,-1,,,83559,18,true,false,,LVFAR00007,,2010-03-02T23:00:00Z,2007-12-31T23:00:00Z,1,true,,Fuente El Relator Villafáfila,1,2,1,false,0,1,,false,2,POINT (-5.617377383752761 41.85083532729508)
,,,,,,-1,-1,-1,,,83560,18,true,false,,LVFAR00008,,2010-03-02T23:00:00Z,2005-12-31T23:00:00Z,1,true,,Fuente las Pozas Villafáfila,1,2,1,false,40,1,,false,2,POINT (-5.621217153523655 41.841866805063987)
,,,,,,-1,-1,-1,,,83561,18,true,false,,LVFAR00009,,2010-03-02T23:00:00Z,2004-12-31T23:00:00Z,1,true,,Área temática de las Zonas Húmedas,1,1,1,false,3000,1,,false,6,POINT (-5.642610733103253 41.808284318776884)
,,,,,,-1,-1,-1,,,83562,18,true,false,,LVFAR00010,,2010-03-02T23:00:00Z,2006-12-31T23:00:00Z,1,true,,Laguna Grande de Manganeses,1,1,1,false,1000,1,,false,2,POINT (-5.713584394951825 41.747499973598984)
,,,,,,-1,-1,-1,,,83563,18,true,false,,LVFAR00011,,2010-03-02T23:00:00Z,2006-07-04T22:00:00Z,1,true,,Junciel,4,1,1,false,3000,1,,false,2,POINT (-5.685441467359518 41.739248515019959)
,,,,,,-1,-1,-1,,,83564,18,true,false,,LVFAR00012,,2010-03-02T23:00:00Z,2000-12-31T23:00:00Z,1,true,,Fuente Salinas Revellinos,1,1,1,false,500,1,,false,2,POINT (-5.551709483932538 41.857265547907865)
,,,,,,-1,-1,-1,,,83566,18,true,false,,LVFAR00014,,2010-03-02T23:00:00Z,2006-12-31T23:00:00Z,1,true,,Área Temática de la Estepa Cerealista,3,1,1,false,5000,27,,false,6,POINT (-5.467560060085359 41.819098446842936)
,,,,,,-1,-1,-1,,,83567,18,true,false,,LVFAR00015,,2010-03-02T23:00:00Z,2005-12-31T23:00:00Z,1,true,,Villarrín de Campos,1,1,1,false,200,1,,false,2,POINT (-5.648851684344395 41.802025893462179)
,,,,,,-1,-1,-1,,,83568,18,true,false,,LVFAR00016,,2010-03-02T23:00:00Z,2005-12-31T23:00:00Z,1,true,,San Martín de Valderaduey,3,1,1,false,400,18,,false,2,POINT (-5.470106850014743 41.815499212716652)
,,,,,,-1,-1,-1,,,83690,18,true,false,,MDLAR00001,,2009-11-25T23:00:00Z,2002-07-31T22:00:00Z,1,true,,Área recreativa del lago de Carucedo,3,1,1,false,0,11,,false,2,POINT (-6.774359292307647 42.489769377008088)
,,,,,,-1,-1,-1,,,83691,18,true,false,,MDLAR00002,2papeleras,2009-11-25T23:00:00Z,2002-07-31T22:00:00Z,1,true,,Área recreativa de Campo de Braña,1,2,1,false,0,1,,false,2,POINT (-6.750811038893268 42.448426903414386)
,,,,,,-1,-1,-1,,,83692,18,true,false,,MDLAR00003,Se accede con vehículo todoterreno o a pie,2009-11-25T23:00:00Z,2002-07-31T22:00:00Z,1,true,,Área recreativa de los Zufreiros del Frade,3,2,2,false,0,3,,false,2,POINT (-6.809851869158964 42.484258461869459)
,,,,,,-1,-1,-1,,,84182,18,true,false,,MOBAR00013,,2009-12-09T23:00:00Z,2006-10-13T22:00:00Z,1,false,,Valpuesta,3,1,1,false,0,11,,false,2,POINT (-3.12506929805215 42.866760065281554)
,,,,,,-1,-1,-1,,,84183,18,true,false,,MOBAR00007,,2009-12-09T23:00:00Z,2006-10-13T22:00:00Z,1,false,,Área recreativa de Frías,1,1,1,false,0,1,,false,2,POINT (-3.293549278924556 42.768848596932607)
,,,,,,-1,-1,-1,,,84184,18,true,false,,MOBAR00008,,2009-12-09T23:00:00Z,2006-10-13T22:00:00Z,1,false,,Área recreativa de Pancorbo,3,2,2,false,0,9,,false,2,POINT (-3.107130303313722 42.639185487020413)
,,,,,,-1,-1,-1,,,84185,18,true,false,,MOBAR00010,,2009-12-09T23:00:00Z,2006-10-13T22:00:00Z,1,false,,Área recreativa Fuente de los Siete Caños,1,1,2,false,0,1,,false,2,POINT (-3.176503136353638 42.772625251610862)
,,,,,,-1,-1,-1,,,84186,18,true,false,,MOBAR00012,,2009-12-09T23:00:00Z,2006-10-13T22:00:00Z,1,false,,Herrán,1,1,2,false,0,1,,false,2,POINT (-3.22553397123605 42.824981898939207)
,,,,,,-1,-1,-1,,,84187,18,true,false,,MOBAR00014,,2009-12-09T23:00:00Z,2006-10-13T22:00:00Z,1,false,,Encío,1,1,2,false,0,1,,false,2,POINT (-3.116823859168141 42.673759137191283)
,,,,,,-1,-1,-1,,,84188,18,true,false,,MOBAR00015,,2009-12-09T23:00:00Z,2006-10-13T22:00:00Z,1,true,,Villafría de San Zadornil,3,1,2,false,0,9,,false,2,POINT (-3.195772217367741 42.834047788716632)
,,,,,,-1,-1,-1,,,84189,18,true,false,,MOBAR00011,,2009-12-09T23:00:00Z,2006-10-13T22:00:00Z,1,false,,El Corral de los Bueyes,1,1,1,false,0,1,,false,2,POINT (-3.150271164281849 42.780237385510169)
,,,,,,-1,-1,-1,,,84190,18,true,false,,MOBAR00001,Las fuentes no funcionan,2009-11-22T23:00:00Z,2006-10-13T22:00:00Z,1,false,,Paseo de la Ría,3,2,1,false,0,3,,false,2,POINT (-3.412666029362674 42.732896169619181)
,,,,,,-1,-1,-1,,,84191,18,true,false,,MOBAR00003,Se puede acceder por una pista forestal en vehículo pero restringida a vehiculos autorizados.Se puede solicitar permiso a la Casa Forestal.,2009-11-23T23:00:00Z,2006-10-13T22:00:00Z,3,false,,Ocejo,1,2,2,false,0,1,,false,2,POINT (-3.417966028918194 42.708488076916055)
,,,,,,-1,-1,-1,,,84192,18,true,false,,MOBAR00004,Se puede acceder por una pista forestal en vehículo pero restringida a vehiculos autorizados.Se puede solicitar permiso a la Casa Forestal.,2009-11-25T23:00:00Z,2006-10-13T22:00:00Z,1,false,,Pociles,1,2,2,false,0,1,,false,2,POINT (-3.399646646115905 42.761263212007115)
,,,,,,-1,-1,-1,,,84193,18,true,false,,MOBAR00006,,2009-12-09T23:00:00Z,2006-10-13T22:00:00Z,1,false,,Área recreativa Encinillas,1,2,2,false,0,1,,false,2,POINT (-3.386015724606749 42.793068839837751)
,,,,,,-1,-1,-1,,,84194,18,true,false,,MOBAR00009,,2009-12-09T23:00:00Z,2006-10-13T22:00:00Z,3,true,,Área recreativa El Desfiladero,1,1,2,false,0,1,,false,2,POINT (-3.092195786863574 42.646690316701324)
,,,,,,-1,-1,-1,,,84195,18,true,false,,MOBAR00002,,2009-11-22T23:00:00Z,2006-10-13T22:00:00Z,3,false,,Área recreativa de Soscastillo,1,2,2,false,0,1,,false,2,POINT (-3.409844363216541 42.741602615450802)
,,,,,,-1,-1,-1,,,84196,18,true,false,,MOBAR00005,,2009-12-09T23:00:00Z,2006-10-13T22:00:00Z,1,false,,Área recreativa del Río,1,2,2,false,0,1,,false,2,POINT (-3.395805782299747 42.794088076216852)
,,,,,,-1,-1,-1,,,85822,18,true,false,,PEUAR00017,,2011-06-12T22:00:00Z,1995-05-29T22:00:00Z,1,false,Carretera local GR-1,Ermita Virgen del Roblo,3,1,2,false,1967,11,,false,1,POINT (-5.127731563089824 42.93450355902042)
,,,,,,-1,-1,-1,,,84486,18,true,true,,MSTAR00001,Los contenedores de basura del AP00001 dan servicio a esta área recreativa. Baños y máquina de agua junto a Casa del Parque dan servicio a esta área recreativa,2010-06-30T22:00:00Z,1995-12-31T23:00:00Z,1,true,Pista forestal y senderos. Junto a MSTAP00001.,Fuente Santiago,1,1,3,false,20000,1,,false,2,POINT (-3.001298915873941 42.941961076810777)
,,,,,,-1,-1,-1,,,84487,18,true,true,,MSTAR00002,,2011-06-11T22:00:00Z,1996-03-13T23:00:00Z,1,false,Pista parcelaria,Merendero Villalba,1,1,2,false,900,1,,false,1,POINT (-3.077936503390977 42.936150565145773)
,,,,,,-1,-1,-1,,,84488,18,true,true,,MSTAR00003,,2011-06-11T22:00:00Z,1996-03-13T23:00:00Z,1,false,Aparcamiento de entrada a Monte Santiago AP00003,Aparcamiento de entrada,2,1,1,false,300,11,,false,4,POINT (-3.034304601050325 42.939044986671497)
,,,,,,-1,-1,-1,,,85046,18,true,false,,NCPAR00001,,2011-06-12T22:00:00Z,2001-08-10T22:00:00Z,1,true,,Paseo de la Alameda,2,1,2,false,0,11,,false,2,POINT (-4.841267898514344 42.063253256794056)
,,,,,,-1,-1,-1,,,85047,18,true,false,,NCPAR00002,,2011-06-12T22:00:00Z,2001-05-16T22:00:00Z,3,false,,La Fuente,2,1,2,false,0,11,,false,1,POINT (-4.831549743713235 42.088875378704294)
,,,,,,-1,-1,-1,,,85048,18,true,false,,NCPAR00003,,2011-06-12T22:00:00Z,2001-05-16T22:00:00Z,1,false,,Virgen de Carejas,1,1,2,false,0,1,,false,2,POINT (-4.672972096278792 42.170356066739188)
,,,,,,-1,-1,-1,,,85049,18,true,false,,NCPAR00004,,2011-06-12T22:00:00Z,2001-05-16T22:00:00Z,3,false,,Ermita San Miguel,3,1,2,false,0,3,,false,1,POINT (-4.837058626176359 42.14513070455618)
,,,,,,-1,-1,-1,,,85050,18,true,false,,NCPAR00005,,2011-06-12T22:00:00Z,2001-05-16T22:00:00Z,1,false,,La Fuente,3,1,2,false,0,11,,false,2,POINT (-4.909585088781244 42.131517992609766)
,,,,,,-1,-1,-1,,,85051,18,true,false,,NCPAR00006,,2011-06-12T22:00:00Z,2001-05-16T22:00:00Z,3,false,,La Laguna,2,1,2,false,0,6,,false,2,POINT (-4.718010752837959 42.026097155721324)
,,,,,,-1,-1,-1,,,85052,18,true,false,,NCPAR00007,,2011-06-12T22:00:00Z,2009-01-14T23:00:00Z,1,false,,El Barrero,3,1,2,false,0,11,,false,2,POINT (-4.91682281698188 41.94235078899338)
,,,,,,-1,-1,-1,,,85053,18,true,false,,NCPAR00008,,2011-06-12T22:00:00Z,2001-05-16T22:00:00Z,1,false,,El Lavadero,2,1,2,false,0,11,,false,1,POINT (-4.988224797140269 41.942009131778825)
,,,,,,-1,-1,-1,,,85054,18,true,false,,NCPAR00009,,2011-06-12T22:00:00Z,2001-05-16T22:00:00Z,1,false,,Área Recreativa Castromocho,2,1,2,false,0,11,,false,1,POINT (-4.826764132615193 42.031609111652173)
,,,,,,-1,-1,-1,,,85146,18,true,true,,OJGAR00001,,2010-06-30T22:00:00Z,2001-01-14T23:00:00Z,1,false,Carratera asfaltada del Ayuntameinto,Alto de Retuerta,2,1,2,false,400,3,,false,1,POINT (-3.637392188447129 43.008572007052351)
,,,,,,-1,-1,-1,,,85147,18,true,true,,OJGAR00002,,2010-06-30T22:00:00Z,1995-01-14T23:00:00Z,1,true,Desde aparcamientos OJGAP0003 Los Nogales y OJGAP0002 Alto de la Concha,Los Nogales,2,1,2,true,3000,9,,false,2,POINT (-3.664731532997257 43.034466641137406)
,,,,,,-1,-1,-1,,,85148,18,true,false,,OJGAR00003,,2010-06-30T22:00:00Z,2001-01-14T23:00:00Z,3,false,Carretera asfaltada BU_526,Vallejo de Sotoscueva,3,1,2,false,100,9,,false,4,POINT (-3.693613506161546 43.044480823144283)
,,,,,,-1,-1,-1,,,85149,18,true,false,,OJGAR00004,,2010-06-30T22:00:00Z,2001-01-14T23:00:00Z,1,false,Carretera asfaltada BU_526,Villabáscones,3,1,2,false,100,9,,false,4,POINT (-3.677986705224525 43.046915737728163)
,,,,,,-1,-1,-1,,,85150,18,true,false,,OJGAR00005,,2010-06-30T22:00:00Z,2001-01-14T23:00:00Z,1,false,Carretera asfaltada de la Diputación,San Roque,3,1,2,false,250,9,,false,4,POINT (-3.669766471611032 43.045441458956383)
,,,,,,-1,-1,-1,,,85151,18,true,false,,OJGAR00006,,2010-06-30T22:00:00Z,2001-01-14T23:00:00Z,3,false,Camino vecinal de hormigón,La Parte de Sotoscueva,3,1,2,false,300,9,,false,4,POINT (-3.701831220554846 43.042692779482636)
,,,,,,-1,-1,-1,,,85152,18,true,false,,OJGAR00007,,2010-06-30T22:00:00Z,2001-01-14T23:00:00Z,1,false,Carretera asfaltada BU_526,Quisicedo,3,1,2,false,40,9,,false,4,POINT (-3.664618690623338 43.049141702571852)
,,,,,,-1,-1,-1,,,85153,18,true,true,,OJGAR00008,,2010-06-30T22:00:00Z,2005-01-14T23:00:00Z,1,true,Desde OJGA0001 de la Casa del Parque por Senda Botanica o por acera peatonal de la carretera Bu_526,Vivero de Quintanilla del Rebollar,3,1,2,true,21000,9,,false,2,POINT (-3.63363668566527 43.057214870928561)
,,,,,,-1,-1,-1,,,85154,18,true,true,,OJGAR00009,,2010-06-30T22:00:00Z,2005-01-14T23:00:00Z,1,true,"Desde aparcamiento OJGAP0001 Casa del Parque, y peatonal desde casco urbano de Quintanilla del Rebollar",Casa del Parque,3,1,2,true,5000,9,,false,2,POINT (-3.627764410883309 43.056286922631472)
